{
    "$schema": "https://json-schema.org/draft/2020-12/schema",
    "$id": "https://example.org/hc18dc-enc-tv01.schema.json",
    "title": "HC18DC-ENC Test Vector v0.1",
    "type": "object",
    "required": [
        "suite_id",
        "key_master_hex",
        "nonce_hex",
        "delimiter_per_byte",
        "record_object",
        "expected"
    ],
    "properties": {
        "suite_id": {
            "type": "string",
            "const": "HC18DC-ENC-v0.1"
        },
        "key_master_hex": {
            "type": "string",
            "pattern": "^[0-9a-fA-F]{64}$",
            "description": "32 bytes hex"
        },
        "nonce_hex": {
            "type": "string",
            "pattern": "^[0-9a-fA-F]{48}$",
            "description": "24 bytes hex"
        },
        "delimiter_per_byte": {
            "type": "string",
            "const": "TURN+Q1"
        },
        "dir_axis_map": {
            "type": "array",
            "items": {
                "type": "integer",
                "minimum": 0,
                "maximum": 17
            },
            "minItems": 8,
            "maxItems": 8,
            "description": "Optional override; length 8."
        },
        "record_object": {
            "type": "object",
            "required": [
                "txn_id",
                "from_account",
                "timestamp"
            ],
            "properties": {
                "txn_id": {
                    "type": "string",
                    "minLength": 1
                },
                "from_account": {
                    "type": "string",
                    "minLength": 1
                },
                "timestamp": {
                    "type": "string",
                    "pattern": "^\\d{4}-\\d{2}-\\d{2}T\\d{2}:\\d{2}:\\d{2}(?:\\.\\d+)?(?:Z|[+-]\\d{2}:\\d{2})$",
                    "description": "ISO8601 timestamp"
                }
            },
            "description": "Transaction record object; will be JCS-canonicalized then UTF-8 encoded."
        },
        "expected": {
            "type": "object",
            "required": [
                "record_jcs_utf8_hex",
                "ciphertext_hex",
                "tag_hex"
            ],
            "properties": {
                "record_jcs_utf8_hex": {
                    "type": "string",
                    "pattern": "^[0-9a-fA-F]*$",
                    "description": "Hex of UTF-8 bytes of JCS(record_object)."
                },
                "ciphertext_hex": {
                    "type": "string",
                    "pattern": "^[0-9a-fA-F]*$",
                    "description": "Hex ciphertext; length must equal record_jcs_utf8_hex length."
                },
                "tag_hex": {
                    "type": "string",
                    "pattern": "^[0-9a-fA-F]{32}$",
                    "description": "16-byte tag as hex (32 hex chars)."
                },
                "plaintext_len_bytes": {
                    "type": "integer",
                    "minimum": 0
                },
                "ciphertext_len_bytes": {
                    "type": "integer",
                    "minimum": 0
                }
            },
            "additionalProperties": true
        }
    },
    "additionalProperties": true
}