{
    "suite_id": "HC18DC-ENC-v0.1",
    "key_master_hex": "00112233445566778899aabbccddeeff00112233445566778899aabbccddeeff",
    "nonce_hex": "00112233445566778899aabbccddeeff0011223344556677",
    "delimiter_per_byte": "TURN+Q1",
    "record_object": {
        "txn_id": "TX-998877",
        "from_account": "ACC-HL18-001",
        "release": "ST-28-v0.1",
        "timestamp": "2026-02-16T13:06:45Z",
        "status": "LOCKED"
    },
    "expected": {
        "record_jcs_utf8_hex": "7b2266726f6d5f6163636f756e74223a224143432d484c31382d303031222c2272656c65617365223a2253542d32382d76302e31222c22737461747573223a224c4f434b4544222c2274696d657374616d70223a22323032362d30322d31365431333a30363a34355a222c2274786e5f6964223a2254582d393938383737227d",
        "ciphertext_hex": "8c3de6366c6d9f2959e3fb706ef4f22a22e14f432db0e036e83a3030b1472be245646c652c71a5143b2293fc23b2ec2b7630c218233422737441ad74b33a3a22ac79422b664522ecaa78693d6673743b47f1163b2232d80537d534322d69bd51b1253a30d634347559222c229e696e176a64a2323bd5642f3939f020375f297d",
        "tag_hex": "00c0a605401a0000c0f60f2009000020"
    }
}